{
  "eventId": "bc4295de-0956-4229-b412-b78ff3b5cc97",
  "eventType": "product.updated",
  "timestamp": "2026-02-16T10:23:00.000Z",
  "version": "v1",
  "source": "product-service",
  "payload": {
    "productId": "prd_2001",
    "changes": {
      "name": "Wireless Mouse Pro",
      "price": 34.99,
      "isActive": true
    },
    "updatedAt": "2026-02-16T10:22:59.000Z"
  }
}
